️ CUSTODY EVIDENCE LOCATION GUIDE
Generated: 2025-10-30 17:34:15


THREATENING BEHAVIOR EVIDENCE:
================================================================================

 FOLDER: custody_screenshots
----------------------------------------

📄 2025-01-08.jpg
Context: 10:25 all > ED = ChatGPT 4o > G Memory Full @ 1:05 PM — 1:11 PM — “Physical Altercation Escalates - Content: ¢ During this time, Emma continues her p...
From: Contact
Score: 141.3


📄 2025-01-08.jpg
Context: 10:25 all > ED = ChatGPT 4o > G Memory Full @ 1:05 PM — 1:11 PM — “Physical Altercation Escalates - Content: ¢ During this time, Emma continues her p...
From: Contact
Score: 141.3


📄 2025-01-08-COLLAGE.jpg
Context: = ChatGPT 4o > G Memory Full @ Memory Full @ Memory Full @ 1:31 PM — Video: “Emma Showering and ’ a 5 1:05 PM — 1:11 PM — “Physical Throwing Stuff" me...
From: Contact
Score: 135.9


📄 2025-01-08-COLLAGE.jpg
Context: = ChatGPT 4o > G Memory Full @ Memory Full @ Memory Full @ 1:31 PM — Video: “Emma Showering and ’ a 5 1:05 PM — 1:11 PM — “Physical Throwing Stuff" me...
From: Contact
Score: 135.9


📄 FullSizeRender(52).jpg
Context: Yah | just did too  I'm really sorry for hitting you Craig. | just don't know what else to do when | get that angry and you won't stop just know that...
From: Contact
Score: 129.0


📄 FullSizeRender(52).jpg
Context: Yah | just did too  I'm really sorry for hitting you Craig. | just don't know what else to do when | get that angry and you won't stop just know that...
From: Contact
Score: 129.0


📄 FullSizeRender(42).jpg
Context: 4:45 ol) LTE (2 My Girl >  wnat Is the coae Tor the cam?  Tue, Jul 2 at 1:44PM So far so good Lost my job That's cool  Tue, Jul 2 at 3:17PM Yah or I'l...
From: Contact
Score: 127.5


📄 FullSizeRender(42).jpg
Context: 4:45 ol) LTE (2 My Girl >  wnat Is the coae Tor the cam?  Tue, Jul 2 at 1:44PM So far so good Lost my job That's cool  Tue, Jul 2 at 3:17PM Yah or I'l...
From: Contact
Score: 127.5


📄 FullSizeRender(39).jpg
Context: 4:44 ol LTE (12 My Girl > ee together for that no problem ina week or so Thu, Jul 4 at 12:36PM I'm sorry baby. I’m so fucking mad at myself for lettin...
From: Contact
Score: 127.5


📄 FullSizeRender(39).jpg
Context: 4:44 ol LTE (12 My Girl > ee together for that no problem ina week or so Thu, Jul 4 at 12:36PM I'm sorry baby. I’m so fucking mad at myself for lettin...
From: Contact
Score: 127.5


📄 FullSizeRender(47).jpg
Context: 4:51 ol LTE (2 My Girl > Riuw Usvivusly Whatta mean like | do! ? Yes that | paid for after paying what | owed. & still have half of not more. It’s not...
From: Contact
Score: 127.2


📄 FullSizeRender(47).jpg
Context: 4:51 ol LTE (2 My Girl > Riuw Usvivusly Whatta mean like | do! ? Yes that | paid for after paying what | owed. & still have half of not more. It’s not...
From: Contact
Score: 127.2


📄 IMG_3688.JPG
Context: Harpers Dad y> WTF Read 5:18PM Fuck offidiot ° Threaten me and find out Lol thanks it wasn’t a threat. It was a joke after you just threatened me. Tha...
From: Craig (Harper's Dad)
Score: 126.6


📄 IMG_3688.JPG
Context: Harpers Dad y> WTF Read 5:18PM Fuck offidiot ° Threaten me and find out Lol thanks it wasn’t a threat. It was a joke after you just threatened me. Tha...
From: Craig (Harper's Dad)
Score: 126.6


📄 IMG_4815-COLLAGE.jpg
Context: you feel you have to she’s being big 2 7 ce) Congratulations!!! 5: "+ spoiled with treats and love a pan T eh y \\g 4 > Mm (“ps s oe 2 ad << SS NOV 12...
From: Emma (Problematic Mother)
Score: 120.2


📄 IMG_4815-COLLAGE.jpg
Context: you feel you have to she’s being big 2 7 ce) Congratulations!!! 5: "+ spoiled with treats and love a pan T eh y \\g 4 > Mm (“ps s oe 2 ad << SS NOV 12...
From: Emma (Problematic Mother)
Score: 120.2


📄 IMG_3705.JPG
Context: 5:442 oll F BE Gordie Defazio < Ra Active now & a & How's your morning JAN 15 AT 11:49 AM Oe) Not bad JAN 18 AT 9:48AM & Good morning beautiful JAN 18...
From: Contact
Score: 117.1


📄 IMG_3705.JPG
Context: 5:442 oll F BE Gordie Defazio < Ra Active now & a & How's your morning JAN 15 AT 11:49 AM Oe) Not bad JAN 18 AT 9:48AM & Good morning beautiful JAN 18...
From: Contact
Score: 117.1


📄 IMG_2655.JPG
Context: Lt (i, Re) se 5 Pht ey: SEU TIS (oe ~ Va ne ae ee eh tA Fi ifs ed | ae "2 Z a8 ASG) WAP aa WA he CoN We eR oe ai Cr | ee | ) ne AS) SARRR A oN. SSE NO...
From: Contact
Score: 65.5


📄 IMG_2655.JPG
Context: Lt (i, Re) se 5 Pht ey: SEU TIS (oe ~ Va ne ae ee eh tA Fi ifs ed | ae "2 Z a8 ASG) WAP aa WA he CoN We eR oe ai Cr | ee | ) ne AS) SARRR A oN. SSE NO...
From: Contact
Score: 65.5


 FOLDER: custody_screenshots\Photos-1-001 (2)
----------------------------------------

📄 2025-01-08(25).jpg
Context: 10:25 all > ED = ChatGPT 4o > G Memory Full @ 1:05 PM — 1:11 PM — “Physical Altercation Escalates - Content: ¢ During this time, Emma continues her p...
From: Contact
Score: 141.3


📄 2025-01-08(25).jpg
Context: 10:25 all > ED = ChatGPT 4o > G Memory Full @ 1:05 PM — 1:11 PM — “Physical Altercation Escalates - Content: ¢ During this time, Emma continues her p...
From: Contact
Score: 141.3


📄 2025-01-08(33).jpg
Context: To some it may seem like it's a small feat, to those close to me it’s probablt a little surprising, but 2024 was the first year since j was probablt 1...
From: Contact
Score: 129.8


📄 2025-01-08(33).jpg
Context: To some it may seem like it's a small feat, to those close to me it’s probablt a little surprising, but 2024 was the first year since j was probablt 1...
From: Contact
Score: 129.8


📄 IMG_2295.JPG
Context: Bob Marley  Once said;  "If she's amazing, she won't be easy. If she's easy,  she won't be amazing. If she's worth it, you won't  give up. If you give...
From: Contact
Score: 129.3


📄 FullSizeRender(93).jpg
Context: Yah | just did too  I'm really sorry for hitting you Craig. | just don't know what else to do when | get that angry and you won't stop just know that...
From: Contact
Score: 129.0


📄 FullSizeRender(93).jpg
Context: Yah | just did too  I'm really sorry for hitting you Craig. | just don't know what else to do when | get that angry and you won't stop just know that...
From: Contact
Score: 129.0


📄 IMG_3680.JPG
Context: Gram mentioned that Dave’s dad died well hung himself, that would be.... |don’t know but grams sister found him hanging there and she remembers her te...
From: Contact
Score: 128.7


📄 IMG_3671.JPG
Context: 10:15 2 all >  If the parent who originally had decision-making  responsibility becomes able to make decisions for  the child again, sole decision-mak...
From: Contact
Score: 128.7


📄 FullSizeRender(83).jpg
Context: 4:45 ol) LTE (2 My Girl >  wnat Is the coae Tor the cam?  Tue, Jul 2 at 1:44PM So far so good Lost my job That's cool  Tue, Jul 2 at 3:17PM Yah or I'l...
From: Contact
Score: 127.5


📄 FullSizeRender(83).jpg
Context: 4:45 ol) LTE (2 My Girl >  wnat Is the coae Tor the cam?  Tue, Jul 2 at 1:44PM So far so good Lost my job That's cool  Tue, Jul 2 at 3:17PM Yah or I'l...
From: Contact
Score: 127.5


📄 FullSizeRender(80).jpg
Context: 4:44 ol LTE (12 My Girl > ee together for that no problem ina week or so Thu, Jul 4 at 12:36PM I'm sorry baby. I’m so fucking mad at myself for lettin...
From: Contact
Score: 127.5


📄 FullSizeRender(80).jpg
Context: 4:44 ol LTE (12 My Girl > ee together for that no problem ina week or so Thu, Jul 4 at 12:36PM I'm sorry baby. I’m so fucking mad at myself for lettin...
From: Contact
Score: 127.5


📄 FullSizeRender(88).jpg
Context: 4:51 ol LTE (2 My Girl > Riuw Usvivusly Whatta mean like | do! ? Yes that | paid for after paying what | owed. & still have half of not more. It’s not...
From: Contact
Score: 127.2


📄 FullSizeRender(88).jpg
Context: 4:51 ol LTE (2 My Girl > Riuw Usvivusly Whatta mean like | do! ? Yes that | paid for after paying what | owed. & still have half of not more. It’s not...
From: Contact
Score: 127.2


📄 IMG_3688.JPG
Context: Harpers Dad y> WTF Read 5:18PM Fuck offidiot ° Threaten me and find out Lol thanks it wasn’t a threat. It was a joke after you just threatened me. Tha...
From: Craig (Harper's Dad)
Score: 126.6


📄 IMG_3705.JPG
Context: 5:442 oll F BE Gordie Defazio < Ra Active now & a & How's your morning JAN 15 AT 11:49 AM Oe) Not bad JAN 18 AT 9:48AM & Good morning beautiful JAN 18...
From: Contact
Score: 117.1


📄 IMG_0059.JPG
Context: i yy adie ee “i | (i¥ X' Lif pa | i 4 te, oe SRO Glayper 11-13-2024—...
From: Contact
Score: 77.7


📄 IMG_0059.JPG
Context: i yy adie ee “i | (i¥ X' Lif pa | i 4 te, oe SRO Glayper 11-13-2024—...
From: Contact
Score: 77.7


📄 IMG_2388.JPG
Context: “4: ae rt hak oe ont eile [ie ey « 7 ce a : ee a a oe ane % foes wah ah a: ee fe» i eS ee eg ees Bree ib ease aa ass ioe aati ee ee Hate 1 Seapets 2 a...
From: Contact
Score: 60.0


📄 2025-01-08(95).jpg
Context: me , | a. ge en | : |  . 8. ait ~~ — == A | _— | : oe ae ee a  . = ao. = A | a fe a oe a 8 eee A! : oy fa - re 2 2 ae : ae f ay a c ae — ae fe ce lee...
From: Contact
Score: 58.6


📄 2025-01-08(95).jpg
Context: me , | a. ge en | : |  . 8. ait ~~ — == A | _— | : oe ae ee a  . = ao. = A | a fe a oe a 8 eee A! : oy fa - re 2 2 ae : ae f ay a c ae — ae fe ce lee...
From: Contact
Score: 58.6


SUBSTANCE ABUSE EVIDENCE:
================================================================================

 FOLDER: custody_screenshots
----------------------------------------

📄 IMG_3798-COLLAGE.jpg
Context: immediate reassignment of Harper's case to an the case closure was predetermined, in = een ae iw * int a fi in S fais ¥ impantaliworkens A ; asking, “...
From: Emma (Problematic Mother)
Score: 142.2


📄 IMG_3798-COLLAGE.jpg
Context: immediate reassignment of Harper's case to an the case closure was predetermined, in = een ae iw * int a fi in S fais ¥ impantaliworkens A ; asking, “...
From: Emma (Problematic Mother)
Score: 142.2


📄 2025-01-08.jpg
Context: 10:25 all > ED = ChatGPT 4o > G Memory Full @ 1:05 PM — 1:11 PM — “Physical Altercation Escalates - Content: ¢ During this time, Emma continues her p...
From: Contact
Score: 141.3


📄 2025-01-08.jpg
Context: 10:25 all > ED = ChatGPT 4o > G Memory Full @ 1:05 PM — 1:11 PM — “Physical Altercation Escalates - Content: ¢ During this time, Emma continues her p...
From: Contact
Score: 141.3


📄 IMG_3841-COLLAGE.jpg
Context: . losing the case on Tuesday, February 13, During the January 14, 2025 court hear 2025. hilure to Respond to an Emergency Call in one . * She has neve...
From: Emma (Problematic Mother)
Score: 140.5


📄 IMG_3841-COLLAGE.jpg
Context: . losing the case on Tuesday, February 13, During the January 14, 2025 court hear 2025. hilure to Respond to an Emergency Call in one . * She has neve...
From: Emma (Problematic Mother)
Score: 140.5


📄 2025-01-08-COLLAGE.jpg
Context: = ChatGPT 4o > G Memory Full @ Memory Full @ Memory Full @ 1:31 PM — Video: “Emma Showering and ’ a 5 1:05 PM — 1:11 PM — “Physical Throwing Stuff" me...
From: Contact
Score: 135.9


📄 2025-01-08-COLLAGE.jpg
Context: = ChatGPT 4o > G Memory Full @ Memory Full @ Memory Full @ 1:31 PM — Video: “Emma Showering and ’ a 5 1:05 PM — 1:11 PM — “Physical Throwing Stuff" me...
From: Contact
Score: 135.9


📄 IMG_3599.JPG
Context: 2:48 0) 56 ED  VVe WUIK TT) OVeI /UU UCLAULIINIICMLS IW) OU COPMIUNILICS across the country. We also provide policing services in more than 600 Indige...
From: Contact
Score: 134.8


📄 IMG_3599.JPG
Context: 2:48 0) 56 ED  VVe WUIK TT) OVeI /UU UCLAULIINIICMLS IW) OU COPMIUNILICS across the country. We also provide policing services in more than 600 Indige...
From: Contact
Score: 134.8


📄 2025-01-08(2).jpg
Context: 10:25 all > ED => ChatGPT 4o > G Memory Full @  1:05 PM — “Physical Altercation Begins (Video Ends) - Content:  « The video ends as Emma grabs hold o...
From: Contact
Score: 125.1


📄 2025-01-08(2).jpg
Context: 10:25 all > ED => ChatGPT 4o > G Memory Full @  1:05 PM — “Physical Altercation Begins (Video Ends) - Content:  « The video ends as Emma grabs hold o...
From: Contact
Score: 125.1


📄 2025-01-08(4).jpg
Context: 10:25 all > ED => ChatGPT 4o > G Memory Full @  1:16 PM — Video: “Baby Gate Blocking Emma - Content:  ¢ You use a baby gate to block Emma from enteri...
From: Contact
Score: 123.7


📄 2025-01-08(4).jpg
Context: 10:25 all > ED => ChatGPT 4o > G Memory Full @  1:16 PM — Video: “Baby Gate Blocking Emma - Content:  ¢ You use a baby gate to block Emma from enteri...
From: Contact
Score: 123.7


📄 FullSizeRender(45).jpg
Context: 4:55 al LTE( 2) My Girl > aa Sat, Jun 22 at 4:02PM Okay. Let me know what the plan is when you know I'll probably be home at like seven thirtyish and...
From: Contact
Score: 123.2


📄 FullSizeRender(45).jpg
Context: 4:55 al LTE( 2) My Girl > aa Sat, Jun 22 at 4:02PM Okay. Let me know what the plan is when you know I'll probably be home at like seven thirtyish and...
From: Contact
Score: 123.2


📄 IMG_4833-COLLAGE.jpg
Context: / ; a tat Are you free tomorrow? —s aN bs f ws. i Yes What's up? “_ : oe es at's up? ~ <— a o Eee, | ae ae ‘S B 3 4 I'll come in tomorrow afternoon if...
From: Emma (Problematic Mother)
Score: 110.1


📄 IMG_4833-COLLAGE.jpg
Context: / ; a tat Are you free tomorrow? —s aN bs f ws. i Yes What's up? “_ : oe es at's up? ~ <— a o Eee, | ae ae ‘S B 3 4 I'll come in tomorrow afternoon if...
From: Emma (Problematic Mother)
Score: 110.1


 FOLDER: custody_screenshots\Photos-1-001 (2)
----------------------------------------

📄 FullSizeRender(19).jpg
Context: 1:57 PM — Audio: “45-Minute Recording on iPad (1:57-2:42 PM) Summary: Audio recording captures further escalating arguments and Emma’s erratic behavi...
From: Emma (Problematic Mother)
Score: 154.7


📄 FullSizeRender(19).jpg
Context: 1:57 PM — Audio: “45-Minute Recording on iPad (1:57-2:42 PM) Summary: Audio recording captures further escalating arguments and Emma’s erratic behavi...
From: Emma (Problematic Mother)
Score: 154.7


📄 2025-01-08(35).jpg
Context: 1:57 PM — Audio: “45-Minute Recording on iPad (1:57-2:42 PM) Summary: Audio recording captures further escalating arguments and Emma’s erratic behavi...
From: Emma (Problematic Mother)
Score: 154.7


📄 2025-01-08(35).jpg
Context: 1:57 PM — Audio: “45-Minute Recording on iPad (1:57-2:42 PM) Summary: Audio recording captures further escalating arguments and Emma’s erratic behavi...
From: Emma (Problematic Mother)
Score: 154.7


📄 2025-01-08(25).jpg
Context: 10:25 all > ED = ChatGPT 4o > G Memory Full @ 1:05 PM — 1:11 PM — “Physical Altercation Escalates - Content: ¢ During this time, Emma continues her p...
From: Contact
Score: 141.3


📄 2025-01-08(25).jpg
Context: 10:25 all > ED = ChatGPT 4o > G Memory Full @ 1:05 PM — 1:11 PM — “Physical Altercation Escalates - Content: ¢ During this time, Emma continues her p...
From: Contact
Score: 141.3


📄 IMG_3599.JPG
Context: 2:48 0) 56 ED  VVe WUIK TT) OVeI /UU UCLAULIINIICMLS IW) OU COPMIUNILICS across the country. We also provide policing services in more than 600 Indige...
From: Contact
Score: 134.8


📄 2025-01-08(65).jpg
Context: Key Takeaway  The primary difference is that opioids create a physical dependency in the baby, leading to withdrawal symptoms after birth, while stimu...
From: Contact
Score: 130.4


📄 2025-01-08(65).jpg
Context: Key Takeaway  The primary difference is that opioids create a physical dependency in the baby, leading to withdrawal symptoms after birth, while stimu...
From: Contact
Score: 130.4


📄 2025-01-08(36).jpg
Context: They create circumstances that are  false. Make you the enemy to  everyone while telling you your the  hero.  And you were ripe for the picking.  | do...
From: Contact
Score: 128.7


📄 2025-01-08(36).jpg
Context: They create circumstances that are  false. Make you the enemy to  everyone while telling you your the  hero.  And you were ripe for the picking.  | do...
From: Contact
Score: 128.7


📄 2025-01-08(21).jpg
Context: 10:25 all > ED => ChatGPT 4o > G Memory Full @  1:05 PM — “Physical Altercation Begins (Video Ends) - Content:  « The video ends as Emma grabs hold o...
From: Contact
Score: 125.1


📄 2025-01-08(21).jpg
Context: 10:25 all > ED => ChatGPT 4o > G Memory Full @  1:05 PM — “Physical Altercation Begins (Video Ends) - Content:  « The video ends as Emma grabs hold o...
From: Contact
Score: 125.1


📄 2025-01-08(26).jpg
Context: 10:25 all > ED => ChatGPT 4o > G Memory Full @  1:16 PM — Video: “Baby Gate Blocking Emma - Content:  ¢ You use a baby gate to block Emma from enteri...
From: Contact
Score: 123.7


📄 2025-01-08(26).jpg
Context: 10:25 all > ED => ChatGPT 4o > G Memory Full @  1:16 PM — Video: “Baby Gate Blocking Emma - Content:  ¢ You use a baby gate to block Emma from enteri...
From: Contact
Score: 123.7


📄 FullSizeRender(86).jpg
Context: 4:55 al LTE( 2) My Girl > aa Sat, Jun 22 at 4:02PM Okay. Let me know what the plan is when you know I'll probably be home at like seven thirtyish and...
From: Contact
Score: 123.2


📄 FullSizeRender(86).jpg
Context: 4:55 al LTE( 2) My Girl > aa Sat, Jun 22 at 4:02PM Okay. Let me know what the plan is when you know I'll probably be home at like seven thirtyish and...
From: Contact
Score: 123.2


📄 2025-01-08(27).jpg
Context: 10:25 all > ED | ChatGPT 4o.> |b G | Memory Full @ 12:56 PM - Video: “Leave the Baby Out of This (1 minute) - Content: * You tell Emma to “leave the...
From: Contact
Score: 121.7


📄 2025-01-08(27).jpg
Context: 10:25 all > ED | ChatGPT 4o.> |b G | Memory Full @ 12:56 PM - Video: “Leave the Baby Out of This (1 minute) - Content: * You tell Emma to “leave the...
From: Contact
Score: 121.7


CUSTODY VIOLATIONS EVIDENCE:
================================================================================

 FOLDER: custody_screenshots
----------------------------------------

📄 IMG_3798-COLLAGE.jpg
Context: immediate reassignment of Harper's case to an the case closure was predetermined, in = een ae iw * int a fi in S fais ¥ impantaliworkens A ; asking, “...
From: Emma (Problematic Mother)
Score: 142.2


📄 IMG_3798-COLLAGE.jpg
Context: immediate reassignment of Harper's case to an the case closure was predetermined, in = een ae iw * int a fi in S fais ¥ impantaliworkens A ; asking, “...
From: Emma (Problematic Mother)
Score: 142.2


📄 IMG_3841-COLLAGE.jpg
Context: . losing the case on Tuesday, February 13, During the January 14, 2025 court hear 2025. hilure to Respond to an Emergency Call in one . * She has neve...
From: Emma (Problematic Mother)
Score: 140.5


📄 IMG_3841-COLLAGE.jpg
Context: . losing the case on Tuesday, February 13, During the January 14, 2025 court hear 2025. hilure to Respond to an Emergency Call in one . * She has neve...
From: Emma (Problematic Mother)
Score: 140.5


📄 IMG_3848.JPG
Context: To: Martine Paquet, Registrar  Email: martine.paquet@nbasw-attsnb.ca Subject: Formal Complaint Against Jacqueline Gallant — Conflict of Interest & Pro...
From: Contact
Score: 138.2


📄 IMG_3848.JPG
Context: To: Martine Paquet, Registrar  Email: martine.paquet@nbasw-attsnb.ca Subject: Formal Complaint Against Jacqueline Gallant — Conflict of Interest & Pro...
From: Contact
Score: 138.2


📄 IMG_3702.JPG
Context: 5:25 97 oil! LTE Jacklyn > Okay if you still have Ed’s number you can reach out to him to book something with him. Thursday 2:44PM lve met with Ed. My...
From: Contact
Score: 126.2


📄 IMG_3702.JPG
Context: 5:25 97 oil! LTE Jacklyn > Okay if you still have Ed’s number you can reach out to him to book something with him. Thursday 2:44PM lve met with Ed. My...
From: Contact
Score: 126.2


📄 IMG_3679.JPG
Context: ge Harper's Dad @ lek)  é I'll tell you tmr +> Al Overview my : A father can give a mother full custody of their child going to court. The best option...
From: Craig (Harper's Dad)
Score: 123.3


📄 IMG_3679.JPG
Context: ge Harper's Dad @ lek)  é I'll tell you tmr +> Al Overview my : A father can give a mother full custody of their child going to court. The best option...
From: Craig (Harper's Dad)
Score: 123.3


📄 IMG_3693.JPG
Context: 5:52 2 oe 22) Harper's Dad ® ents <f@ "ll make sure it's easy  All Videos Images Shortvideos News _ Shoppir These are results for how a father gives m...
From: Craig (Harper's Dad)
Score: 122.5


📄 IMG_3693.JPG
Context: 5:52 2 oe 22) Harper's Dad ® ents <f@ "ll make sure it's easy  All Videos Images Shortvideos News _ Shoppir These are results for how a father gives m...
From: Craig (Harper's Dad)
Score: 122.5


📄 IMG_3847-COLLAGE.jpg
Context: 1. Conflict of interest & Dishonesty in Disclosure vans . a rs On Thursday, February 8, 2025, at 10:04 AM, | oe i sent a text message to Jacqueline Ga...
From: Contact
Score: 111.0


📄 IMG_3847-COLLAGE.jpg
Context: 1. Conflict of interest & Dishonesty in Disclosure vans . a rs On Thursday, February 8, 2025, at 10:04 AM, | oe i sent a text message to Jacqueline Ga...
From: Contact
Score: 111.0


📄 IMG_3682.JPG
Context: G:a5 al F@ <4 ChatGPT < bs -MyGirls- -Aintn...  @& war" The steps Im getting are... 25 @ r Next Steps for Filing: ey Aes LOS 1. Emma Files: Emma files...
From: Contact
Score: 102.3


📄 IMG_3682.JPG
Context: G:a5 al F@ <4 ChatGPT < bs -MyGirls- -Aintn...  @& war" The steps Im getting are... 25 @ r Next Steps for Filing: ey Aes LOS 1. Emma Files: Emma files...
From: Contact
Score: 102.3


📄 FullSizeRender(55).jpg
Context: LITEyOu TN Get SEfved) WIth Court we'll there. luck. 111 ‘oujat the oh noweatseo, Yo ey :...
From: Contact
Score: 98.0


📄 FullSizeRender(55).jpg
Context: LITEyOu TN Get SEfved) WIth Court we'll there. luck. 111 ‘oujat the oh noweatseo, Yo ey :...
From: Contact
Score: 98.0


 FOLDER: custody_screenshots\Photos-1-001 (2)
----------------------------------------

📄 FullSizeRender(19).jpg
Context: 1:57 PM — Audio: “45-Minute Recording on iPad (1:57-2:42 PM) Summary: Audio recording captures further escalating arguments and Emma’s erratic behavi...
From: Emma (Problematic Mother)
Score: 154.7


📄 FullSizeRender(19).jpg
Context: 1:57 PM — Audio: “45-Minute Recording on iPad (1:57-2:42 PM) Summary: Audio recording captures further escalating arguments and Emma’s erratic behavi...
From: Emma (Problematic Mother)
Score: 154.7


📄 2025-01-08(35).jpg
Context: 1:57 PM — Audio: “45-Minute Recording on iPad (1:57-2:42 PM) Summary: Audio recording captures further escalating arguments and Emma’s erratic behavi...
From: Emma (Problematic Mother)
Score: 154.7


📄 2025-01-08(35).jpg
Context: 1:57 PM — Audio: “45-Minute Recording on iPad (1:57-2:42 PM) Summary: Audio recording captures further escalating arguments and Emma’s erratic behavi...
From: Emma (Problematic Mother)
Score: 154.7


📄 IMG_3669.JPG
Context: Next Steps for Filing:  1. Emma Files: Emma files a motion to withdraw or amend her affidavit.  2. Submit a Joint Statement (Optional): Both of you si...
From: Contact
Score: 129.8


📄 IMG_3702.JPG
Context: 5:25 97 oil! LTE Jacklyn > Okay if you still have Ed’s number you can reach out to him to book something with him. Thursday 2:44PM lve met with Ed. My...
From: Contact
Score: 126.2


📄 IMG_3679.JPG
Context: ge Harper's Dad @ lek)  é I'll tell you tmr +> Al Overview my : A father can give a mother full custody of their child going to court. The best option...
From: Craig (Harper's Dad)
Score: 123.3


📄 IMG_3693.JPG
Context: 5:52 2 oe 22) Harper's Dad ® ents <f@ "ll make sure it's easy  All Videos Images Shortvideos News _ Shoppir These are results for how a father gives m...
From: Craig (Harper's Dad)
Score: 122.5


📄 IMG_3682.JPG
Context: G:a5 al F@ <4 ChatGPT < bs -MyGirls- -Aintn...  @& war" The steps Im getting are... 25 @ r Next Steps for Filing: ey Aes LOS 1. Emma Files: Emma files...
From: Contact
Score: 102.3


📄 IMG_3622.JPG
Context: a rend to proceed in or present evidence in the (a) ifyou \ language, an interpreter may be required and Shite ther official the administrator at leas...
From: Contact
Score: 98.9


📄 FullSizeRender(96).jpg
Context: LITEyOu TN Get SEfved) WIth Court we'll there. luck. 111 ‘oujat the oh noweatseo, Yo ey :...
From: Contact
Score: 98.0


📄 FullSizeRender(96).jpg
Context: LITEyOu TN Get SEfved) WIth Court we'll there. luck. 111 ‘oujat the oh noweatseo, Yo ey :...
From: Contact
Score: 98.0


📄 IMG_3631.JPG
Context: _ (d) if you intend sas re _ ae Senin to proceed IN OF present evidence in the d) si Vous entendez employer |’ aut anguage, an interpreter may be requ...
From: Contact
Score: 97.9


📄 FullSizeRender(100).jpg
Context: Lifeyou li get served with) court Good) luck. I/II ‘oujatithe oft \ house at 3:50....
From: Contact
Score: 95.5


📄 FullSizeRender(100).jpg
Context: Lifeyou li get served with) court Good) luck. I/II ‘oujatithe oft \ house at 3:50....
From: Contact
Score: 95.5


📄 IMG_3623.JPG
Context: Se —— Court File Number, ne KING'S BENCH OF NEV BRUNSWICK By pisTRICT OF SAINT JON " Peourt oF KING'S BENCH ~ SHULL | Fitep/ REGt me pec 16 vit 7 AFFI...
From: Contact
Score: 89.3


📄 IMG_3630.JPG
Context: No au dossrerfCourt Pile Nuader 130). Ho dn dosslerfCourt File Number FDS) us Tht COURT OF KING'S BENCH OF NEW BRUNSWICK RAMILY DIVISION JUDICIAL DIST...
From: Contact
Score: 80.2


 FOLDER: custody_screenshots\custodyemailndoc\Photos-1-001 (2)
----------------------------------------

📄 IMG_3848.JPG
Context: To: Martine Paquet, Registrar  Email: martine.paquet@nbasw-attsnb.ca Subject: Formal Complaint Against Jacqueline Gallant — Conflict of Interest & Pro...
From: Contact
Score: 138.2


FINANCIAL ISSUES EVIDENCE:
================================================================================

 FOLDER: custody_screenshots
----------------------------------------

📄 IMG_3798-COLLAGE.jpg
Context: immediate reassignment of Harper's case to an the case closure was predetermined, in = een ae iw * int a fi in S fais ¥ impantaliworkens A ; asking, “...
From: Emma (Problematic Mother)
Score: 142.2

📄 IMG_3841-COLLAGE.jpg
Context: . losing the case on Tuesday, February 13, During the January 14, 2025 court hear 2025. hilure to Respond to an Emergency Call in one . * She has neve...
From: Emma (Problematic Mother)
Score: 140.5


📄 IMG_3848.JPG
Context: To: Martine Paquet, Registrar  Email: martine.paquet@nbasw-attsnb.ca Subject: Formal Complaint Against Jacqueline Gallant — Conflict of Interest & Pro...
From: Contact
Score: 138.2


📄 FullSizeRender(23).jpg
Context: ._ = Sun, Jul 28 at 4:00PM "Figure what out emma? Good to know we need more ay I'm getting 60 when he comes in so let How much to take out for you to...
From: Contact
Score: 121.8


📄 FullSizeRender(29).jpg
Context: 2:03 al! > 2D My Girl> Sat, Jul 27 at 7:35PM Did you get smokes? Sun, Jul 28 at 4:00PM Good to know we need more ed I'm getting 60 when he comes in so...
From: Contact
Score: 120.9


📄 IMG_4851-COLLAGE.jpg
Context: adjusted as Harper grows and calls every night after Harper's her needs change, with both feeding or during the nightly parents’ agreement. updates. -...
From: Contact
Score: 120.0


 FOLDER: custody_screenshots\Photos-1-001 (2)
----------------------------------------

📄 IMG_3599.JPG
Context: 2:48 0) 56 ED  VVe WUIK TT) OVeI /UU UCLAULIINIICMLS IW) OU COPMIUNILICS across the country. We also provide policing services in more than 600 Indige...
From: Contact
Score: 134.8

📄 2025-01-08(34).jpg
Context: 2024-10-15 Financial Made aware that rent wasn't actually figured out as Emma claimed. Her plan was to get Ali to pay it. Ali texted the landlord she...
From: Contact
Score: 124.7

📄 FullSizeRender(74).jpg
Context: 4:23 al LTESS < es) Or My Girl > SES Lol, you don’t support shit. You literally don’t support shit and | pay for it half the time and you even smoke m...
From: EMMA GETTING DEFENSIVFE BECAUSE GOOGLE TOLD ME KIRKLAND IS BEST COST VALUE FORMULA
Score: 122.2



📄 2025-01-08(57).jpg
Context: Today 2:18PM  Bottom Line:  + If Cost is the Main Factor: Kirkland provides excellent value for the money and meets all basic nutritional needs.  + If...
From: EMMA AND CRAIG DISCUSSING HER CHANGING FORMULA FOR 2/3RD TIME IN LESS THAN 6 MONTHS WITHOUT ASKING HER DOCTOR FIRST, AND IGNORING THE ACTUAL REASON AS TO WHY HARPER WAS SO CONGESTED, METH, WEED, VAPE, SMOKES.... FFS
Score: 121.8


📄 FullSizeRender(63).jpg
Context: ._ = Sun, Jul 28 at 4:00PM "Figure what out emma? Good to know we need more ay I'm getting 60 when he comes in so let How much to take out for you to...
From: Contact
Score: 121.8

📄 FullSizeRender(51).jpg
Context: 2:03 al! > 2D My Girl> Sat, Jul 27 at 7:35PM Did you get smokes? Sun, Jul 28 at 4:00PM Good to know we need more ed I'm getting 60 when he comes in so...
From: Contact
Score: 120.9


📄 2025-01-08(29).jpg
Context: 10:25 all > & => ChatGPT 4o > G Memory Full @  1:57 PM — Audio: “45-Minute Recording on iPad (1:57-2:42 PM) - Content:  « Audio captures the events a...
From: Contact
Score: 117.8


📄 2025-01-08(100).jpg
Context: 4:12 oll LTE (11 < @F ° BenNiller \. ow Ben Miller You're friends on Facebook Lives in Saint John, New Brunswick Firefighter at Saint John Fire Depart...
From: Contact
Score: 116.5


📄 2025-01-08(100).jpg
Context: 4:12 oll LTE (11 < @F ° BenNiller \. ow Ben Miller You're friends on Facebook Lives in Saint John, New Brunswick Firefighter at Saint John Fire Depart...
From: Contact
Score: 116.5


📄 FullSizeRender(70).jpg
Context: < @ ~ BenMiller q& ax — a e Ben Miller You're friends on Facebook Lives in Saint John, New Brunswick Firefighter at Saint John Fire Department View pr...
From: Contact
Score: 116.2


📄 FullSizeRender(70).jpg
Context: < @ ~ BenMiller q& ax — a e Ben Miller You're friends on Facebook Lives in Saint John, New Brunswick Firefighter at Saint John Fire Department View pr...
From: Contact
Score: 116.2


📄 FullSizeRender(43).jpg
Context: 2:21 al) S Bor My Girl > Tormura ana suck witn IL unless there's a medical reason to switch. + Message gv Civ) Same but | was just asking since | woul...
From: emma
Score: 112.9


📄 FullSizeRender(43).jpg
Context: 2:21 al) S Bor My Girl > Tormura ana suck witn IL unless there's a medical reason to switch. + Message gv Civ) Same but | was just asking since | woul...
From: EMMA  
Score: 112.9


 FOLDER: custody_screenshots\brunswickshitshow n insulation
----------------------------------------

📄 FullSizeRender.jpg
Context: < @ ~ BenMiller q& ax — a e Ben Miller You're friends on Facebook Lives in Saint John, New Brunswick Firefighter at Saint John Fire Department View pr...
From: Contact BEN BenMiller
Score: 116.2


📄 FullSizeRender.jpg
Context: < @ ~ BenMiller q& ax — a e Ben Miller You're friends on Facebook Lives in Saint John, New Brunswick Firefighter at Saint John Fire Department View pr...
From: ContactBEN Miller
Score: 116.2


 FOLDER: custody_screenshots\custodyemailndoc\Photos-1-001 (2)
----------------------------------------

📄 IMG_3848.JPG
Context: To: Martine Paquet, Registrar  Email: martine.paquet@nbasw-attsnb.ca Subject: Formal Complaint Against Jacqueline Gallant — Conflict of Interest & Pro...
From: Contact
Score: 138.2



EVIDENCE SUMMARY:
================================================================================

Top Evidence by Category:


THREATENING BEHAVIOR:
- 2025-01-08.jpg (custody_screenshots\2025-01-08.jpg)
  Context: 10:25 all > ED = ChatGPT 4o > G Memory Full @ 1:05 PM — 1:11 PM — “Physical Altercation Escalates -...
- 2025-01-08(25).jpg (custody_screenshots\Photos-1-001 (2)\2025-01-08(25).jpg)
  Context: 10:25 all > ED = ChatGPT 4o > G Memory Full @ 1:05 PM — 1:11 PM — “Physical Altercation Escalates -...
- 2025-01-08.jpg (custody_screenshots\2025-01-08.jpg)
  Context: 10:25 all > ED = ChatGPT 4o > G Memory Full @ 1:05 PM — 1:11 PM — “Physical Altercation Escalates -...

SUBSTANCE ABUSE:
- FullSizeRender(19).jpg (custody_screenshots\Photos-1-001 (2)\FullSizeRender(19).jpg)
  Context: 1:57 PM — Audio: “45-Minute Recording on iPad (1:57-2:42 PM) Summary: Audio recording captures furt...
- FullSizeRender(19).jpg (custody_screenshots\Photos-1-001 (2)\FullSizeRender(19).jpg)
  Context: 1:57 PM — Audio: “45-Minute Recording on iPad (1:57-2:42 PM) Summary: Audio recording captures furt...
- 2025-01-08(35).jpg (custody_screenshots\Photos-1-001 (2)\2025-01-08(35).jpg)
  Context: 1:57 PM — Audio: “45-Minute Recording on iPad (1:57-2:42 PM) Summary: Audio recording captures furt...

CUSTODY VIOLATIONS:
- FullSizeRender(19).jpg (custody_screenshots\Photos-1-001 (2)\FullSizeRender(19).jpg)
  Context: 1:57 PM — Audio: “45-Minute Recording on iPad (1:57-2:42 PM) Summary: Audio recording captures furt...
- FullSizeRender(19).jpg (custody_screenshots\Photos-1-001 (2)\FullSizeRender(19).jpg)
  Context: 1:57 PM — Audio: “45-Minute Recording on iPad (1:57-2:42 PM) Summary: Audio recording captures furt...
- 2025-01-08(35).jpg (custody_screenshots\Photos-1-001 (2)\2025-01-08(35).jpg)
  Context: 1:57 PM — Audio: “45-Minute Recording on iPad (1:57-2:42 PM) Summary: Audio recording captures furt...

FINANCIAL ISSUES:
- FullSizeRender(19).jpg (custody_screenshots\Photos-1-001 (2)\FullSizeRender(19).jpg)
  Context: 1:57 PM — Audio: “45-Minute Recording on iPad (1:57-2:42 PM) Summary: Audio recording captures furt...
- FullSizeRender(19).jpg (custody_screenshots\Photos-1-001 (2)\FullSizeRender(19).jpg)
  Context: 1:57 PM — Audio: “45-Minute Recording on iPad (1:57-2:42 PM) Summary: Audio recording captures furt...
- 2025-01-08(35).jpg (custody_screenshots\Photos-1-001 (2)\2025-01-08(35).jpg)
  Context: 1:57 PM — Audio: “45-Minute Recording on iPad (1:57-2:42 PM) Summary: Audio recording captures furt...

END OF EXHIBIT LIST
